{
  "meta": {
    "generatedAt": "2026-03-26T23:30:00Z",
    "dataSources": ["WebSearch", "WebFetch", "Exa", "xAI"],
    "companyContext": true
  },
  "investor": {
    "name": "Paul Graham",
    "role": "Co-founder",
    "fund": "Y Combinator",
    "about": "English-American computer scientist, essayist, programmer, and investor. Born November 13, 1964 in Weymouth, Dorset, England. Co-founded Viaweb in 1995 (acquired by Yahoo for $49M, became Yahoo Store). Co-founded Y Combinator in 2005 with Jessica Livingston, Robert Morris, and Trevor Blackwell. YC has funded over 5,000 startups including Airbnb, Stripe, Dropbox, Coinbase, DoorDash, Reddit, and OpenAI. Author of On Lisp, ANSI Common Lisp, and Hackers & Painters. Created the programming language Arc and the news aggregator Hacker News. Still actively angel investing and advising YC startups; sits on YC's board. Lives in England with wife Jessica Livingston since 2016.",
    "linkedin": "https://uk.linkedin.com/in/paul-graham-899452316",
    "twitter": "https://x.com/paulg",
    "website": "https://paulgraham.com",
    "sweetSpot": "$150K-$500K",
    "stageFocus": "Pre-seed / Seed"
  },
  "company": {
    "name": "VC Whisper",
    "website": "https://vcwhisper.com",
    "description": "AI-powered investor research tool for founders. Enter an investor name or paste a pitch transcript, get a full briefing with career history, portfolio, relevant tweets, game plan, and predicted questions.",
    "stage": "Pre-seed",
    "raising": "$1.5M"
  },
  "fitScore": {
    "score": 79,
    "explanation": "PG has backed multiple developer tools and founder-facing infrastructure through YC and personal angel checks. His recent investments in Bindwell and Channel3 show he still writes seed checks for startups he believes in. VC Whisper's thesis (founders waste time on bad-fit investors) maps to his essays on removing friction and doing things that don't scale. However, PG recently emphasized that founders matter more than ideas, and investor tooling is a narrow TAM compared to his biggest wins. His CNBC comments about non-AI companies being impressive suggest leading with the problem, not the AI.",
    "thesisAlignment": "Strong. PG values tools that remove friction from the startup process. His essay 'Schlep Blindness' is about exactly this category of overlooked, painful problem.",
    "portfolioPatternMatch": "Moderate. YC has backed founder tools (Clerky, Stripe Atlas) and PG personally backed Channel3 (agentic commerce infrastructure). But VC Whisper's TAM is narrower than PG typically prefers unless the wedge-to-platform story is compelling.",
    "stageFit": "Perfect. Pre-seed with traction is PG's sweet spot. His recent personal investments (Bindwell, Channel3, Autosana, Orange Slice) are all seed-stage.",
    "checkSizeFit": "$1.5M raise fits within YC's standard deal plus PG's personal angel range."
  },
  "career": [
    {
      "role": "Co-founder & Board Member",
      "company": "Y Combinator",
      "startYear": "2005",
      "endYear": "present",
      "note": "Co-founded the most influential startup accelerator with Jessica Livingston, Robert Morris, and Trevor Blackwell. Led YC as president until 2014, now serves on the board (3 of 5 board seats per his March 2026 tweet). YC has funded over 5,000 startups worth over $600B combined, including Airbnb, Stripe, Dropbox, Coinbase, DoorDash, Reddit, and OpenAI."
    },
    {
      "role": "Co-founder & CEO",
      "company": "Viaweb",
      "startYear": "1995",
      "endYear": "1998",
      "note": "Built one of the first SaaS web applications for e-commerce with Robert Morris. Acquired by Yahoo for $49M in 1998. Became Yahoo Store. This experience directly informed his essays on startups and his founding of YC."
    },
    {
      "role": "Essayist & Author",
      "company": "paulgraham.com",
      "startYear": "2001",
      "endYear": "present",
      "note": "200+ essays on startups, programming, and technology. paulgraham.com gets ~25M page views/year. 'Founder Mode' (Sep 2024) went viral with 20M+ views on X. Other canonical essays: 'Do Things That Don't Scale', 'Schlep Blindness', 'How to Start a Startup'. Books: On Lisp, ANSI Common Lisp, Hackers & Painters."
    },
    {
      "role": "Angel Investor",
      "company": "Personal",
      "startYear": "2014",
      "endYear": "present",
      "note": "62+ personal angel investments post-YC. Recent: Autosana (Feb 2026), Orange Slice (Feb 2026), Channel3 (Dec 2025), Bindwell (Nov 2025), Wordware (Nov 2024). Still names startups for YC batches and does office hours with founders."
    }
  ],
  "education": [
    {
      "degree": "PhD Computer Science",
      "institution": "Harvard University",
      "note": "Thesis: 'The State of a Program and Its Uses' (1990)"
    },
    {
      "degree": "AB",
      "institution": "Cornell University"
    },
    {
      "degree": "Studied Painting",
      "institution": "Rhode Island School of Design (RISD) & Accademia di Belle Arti, Florence"
    }
  ],
  "portfolio": [
    {"company": "Stripe", "stage": "Seed", "categories": ["Fintech", "Payments"], "date": "2009 (YC S09)", "status": "Active ($107B valuation)"},
    {"company": "Airbnb", "stage": "Seed", "categories": ["Marketplace", "Travel"], "date": "2009 (YC W09)", "status": "IPO (2020, >$100B)"},
    {"company": "OpenAI", "stage": "Seed", "categories": ["AI", "Research"], "date": "2015 (YC Research)", "status": "Active ($500B valuation)"},
    {"company": "Dropbox", "stage": "Seed", "categories": ["SaaS", "Cloud Storage"], "date": "2007 (YC S07)", "status": "IPO (2018, $9B)"},
    {"company": "Coinbase", "stage": "Seed", "categories": ["Crypto", "Finance"], "date": "2012 (YC S12)", "status": "IPO (2021, $86B)"},
    {"company": "DoorDash", "stage": "Seed", "categories": ["Marketplace", "Delivery"], "date": "2013 (YC S13)", "status": "IPO (2020, $39B)"},
    {"company": "Reddit", "stage": "Seed", "categories": ["Social", "Community"], "date": "2005 (YC S05)", "status": "IPO (2024, $6.4B)"},
    {"company": "Scale AI", "stage": "Seed", "categories": ["AI", "Data"], "date": "2016 (YC S16)", "status": "Active ($14B, Meta acquired 49%)"},
    {"company": "Instacart", "stage": "Seed", "categories": ["Marketplace", "Grocery"], "date": "2012 (YC S12)", "status": "IPO (2023, $10B)"},
    {"company": "Twitch", "stage": "Seed", "categories": ["Streaming", "Gaming"], "date": "2007 (YC W07)", "status": "Acquired by Amazon ($970M)"},
    {"company": "Bindwell", "stage": "Seed (Personal)", "categories": ["AI", "Biotech", "Agriculture"], "date": "Nov 2025", "status": "Raised $6M seed"},
    {"company": "Channel3", "stage": "Seed (Personal)", "categories": ["AI", "Commerce", "Infrastructure"], "date": "Dec 2025", "status": "Raised $6M seed"}
  ],
  "press": [
    {
      "title": "Paul Graham on The Social Radars (with Jessica Livingston)",
      "source": "The Social Radars Podcast",
      "date": "Mar 2026",
      "url": "https://www.thesocialradars.com/episodes",
      "summary": "Appeared alongside Jessica Livingston and Carolynn Levy (3 of 5 YC board members). Discussed YC under Garry Tan's leadership, recalled meeting Mark Zuckerberg circa 2007 and his lack of small talk. Said 'I didn't realize how important small talk was until I met the lack of it.' Fortune, Inc., AOL all covered this episode."
    },
    {
      "title": "Not Every New Company Needs to Be About AI",
      "source": "CNBC",
      "date": "Aug 2025",
      "url": "https://www.cnbc.com/2025/08/18/yc-co-founder-paul-graham-not-every-new-company-needs-to-be-about-ai.html",
      "summary": "Stated the two most impressive companies in the current YC batch were not AI companies. Emphasized 'the founders matter more than the idea. The founders are the best predictor of how a company will do, not the industry it's in.' Told non-AI founders: 'If you're good, good investors will see it.'"
    },
    {
      "title": "Teen Founders Raise $6M to Reinvent Pesticides Using AI, Backed by Paul Graham",
      "source": "TechCrunch",
      "date": "Nov 2025",
      "url": "https://techcrunch.com/2025/11/13/teen-founders-raise-6m-to-reinvent-pesticides-using-ai-and-convince-paul-graham-to-join-in/",
      "summary": "Met Bindwell's 18- and 19-year-old founders at his home, spoke for 45 minutes, then suggested they pivot from selling tools to discovering molecules themselves. Wrote a personal check. Posted on X: 'The founders will probably do alright. They're smart and have a good idea.'"
    },
    {
      "title": "Founder Mode (essay, 20M+ views on X)",
      "source": "paulgraham.com",
      "date": "Sep 2024",
      "url": "https://paulgraham.com/foundermode.html",
      "summary": "Viral essay inspired by Brian Chesky's talk about the failure of 'hire good people and give them room' advice at Airbnb. Coined the terms 'founder mode' vs. 'manager mode'. Argued business schools don't teach founder mode but should. Garnered 20M+ Twitter impressions."
    }
  ],
  "relevantContent": [
    {
      "text": "The founders matter more than the idea. The founders are the best predictor of how a company will do, not the industry it's in.",
      "source": "CNBC interview",
      "date": "Aug 2025",
      "url": "https://www.cnbc.com/2025/08/18/yc-co-founder-paul-graham-not-every-new-company-needs-to-be-about-ai.html",
      "relevance": "VC Whisper should lead with the founders and the problem, not 'AI-powered.' PG explicitly said the best companies in the current batch aren't AI. He'll evaluate the founders first."
    },
    {
      "text": "If you want to start a startup to work on a non-AI idea, go ahead. If you're good, good investors will see it, and those are the only ones you want to convince anyway.",
      "source": "CNBC interview",
      "date": "Aug 2025",
      "url": "https://www.cnbc.com/2025/08/18/yc-co-founder-paul-graham-not-every-new-company-needs-to-be-about-ai.html",